{
  "artifact_sha256": "3333333333333333333333333333333333333333333333333333333333333333",
  "build_commit": "0000000000000000000000000000000000000000",
  "config_bundle_sha256": "2222222222222222222222222222222222222222222222222222222222222222",
  "contract_manifest_sha256": "1111111111111111111111111111111111111111111111111111111111111111",
  "emitted_at_us": 1786156800123456,
  "event_id": "evt_triad_execution_authorization_v3",
  "event_kind": "EXECUTION_AUTHORIZATION",
  "payload": {
    "account_id": "x",
    "allowed_liquidity": [],
    "allowed_order_roles": [],
    "allowed_tif": [],
    "candidate_id": "x",
    "canonical_instrument_id": "x",
    "decision_id": "x",
    "direction": "LONG",
    "entry_geometry": {},
    "invalidation_geometry": {},
    "lease_epoch": "1",
    "max_notional_quote": "0",
    "max_qty_steps": "0",
    "position_effect": "OPEN",
    "protection_budget": "x",
    "protection_deadline_us": 1786156800123456,
    "reservation_id": "x",
    "risk_decision_id": "x",
    "scope": {},
    "target_geometry": {},
    "valid_until_us": 1786156800123456,
    "venue_activation_revision": "1",
    "venue_environment": "LIVE"
  },
  "producer_epoch": "42",
  "producer_instance_id": "inst_golden_01",
  "producer_service": "triad-e08",
  "schema": "triad.execution_authorization.v3",
  "schema_version": "3.0.0"
}
